{
  "$schema": "https://json-schema.org/draft/2020-12/schema",
  "$id": "https://github.com/your-org/copilot-marketplace/schemas/marketplace.schema.json",
  "title": "Copilot plugin marketplace manifest (marketplace.json)",
  "description": "Generated catalog. Do not edit by hand — run `bun run marketplace`.",
  "type": "object",
  "required": ["name", "owner", "plugins"],
  "additionalProperties": false,
  "properties": {
    "name": {
      "type": "string",
      "pattern": "^[a-z0-9]+(-[a-z0-9]+)*$",
      "minLength": 1,
      "maxLength": 64
    },
    "owner": {
      "type": "object",
      "required": ["name"],
      "additionalProperties": false,
      "properties": {
        "name": { "type": "string", "minLength": 1 },
        "email": { "type": "string", "format": "email" }
      }
    },
    "metadata": {
      "type": "object",
      "additionalProperties": false,
      "properties": {
        "description": { "type": "string" },
        "version": { "type": "string" },
        "repository": { "type": "string" },
        "pluginRoot": { "type": "string" }
      }
    },
    "plugins": {
      "type": "array",
      "items": { "$ref": "#/$defs/pluginEntry" }
    }
  },
  "$defs": {
    "repositoryUrl": {
      "type": "string",
      "description": "Complete HTTPS repository URL without embedded credentials, whitespace, or backslashes.",
      "format": "uri",
      "pattern": "^[Hh][Tt][Tt][Pp][Ss]://[^/@?#\\s\\\\]+(?:[/?#][^\\s\\\\]*)?(?![\\s\\S])"
    },
    "pluginEntry": {
      "type": "object",
      "required": ["name", "source"],
      "additionalProperties": false,
      "properties": {
        "name": {
          "type": "string",
          "pattern": "^[a-z0-9]+(-[a-z0-9]+)*$",
          "minLength": 1,
          "maxLength": 64
        },
        "source": {
          "description": "Where a client fetches the plugin from.",
          "anyOf": [
            { "$ref": "#/$defs/repositoryUrl" },
            { "$ref": "plugin.schema.json#/$defs/githubSource" },
            { "$ref": "plugin.schema.json#/$defs/urlSource" }
          ]
        },
        "description": { "type": "string", "maxLength": 1024 },
        "version": { "type": "string" },
        "author": {
          "type": "object",
          "required": ["name"],
          "additionalProperties": false,
          "properties": {
            "name": { "type": "string", "minLength": 1 },
            "email": { "type": "string", "format": "email" },
            "url": { "type": "string", "format": "uri" }
          }
        },
        "homepage": { "type": "string", "format": "uri" },
        "repository": { "$ref": "#/$defs/repositoryUrl" },
        "license": { "type": "string" },
        "keywords": { "type": "array", "items": { "type": "string" } },
        "category": { "type": "string" },
        "tags": { "type": "array", "items": { "type": "string" } },
        "directory": { "$ref": "plugin.schema.json#/$defs/directory" }
      }
    }
  }
}
