{
  "name": "copilot-marketplace",
  "owner": {
    "name": "Developer Experience",
    "email": "copilot-marketplace@example.com"
  },
  "metadata": {
    "description": "Internal Copilot plugins for everyday engineering workflows.",
    "version": "1.0.0",
    "repository": "https://github.com/your-org/copilot-marketplace"
  },
  "plugins": [
    {
      "name": "api-contract-check",
      "source": {
        "source": "github",
        "repo": "your-org/api-contract-check"
      },
      "description": "Detect breaking changes in an OpenAPI document and list the consumers each change affects.",
      "version": "1.0.0",
      "author": {
        "name": "Platform Engineering"
      },
      "repository": "https://github.com/your-org/api-contract-check",
      "category": "Code quality",
      "directory": {
        "sample": true,
        "type": "skill",
        "updated": "2026-08-06"
      }
    },
    {
      "name": "changelog-writer",
      "source": {
        "source": "github",
        "repo": "your-org/changelog-writer"
      },
      "description": "Turn a range of commits into a changelog entry written for the people who use the service.",
      "version": "1.3.1",
      "author": {
        "name": "Developer Experience"
      },
      "repository": "https://github.com/your-org/changelog-writer",
      "category": "Delivery",
      "directory": {
        "sample": true,
        "type": "skill",
        "updated": "2026-09-02"
      }
    },
    {
      "name": "conventional-commits",
      "source": {
        "source": "github",
        "repo": "your-org/conventional-commits-hook"
      },
      "description": "Block a commit whose message does not follow the repository's conventional commit format.",
      "version": "1.0.1",
      "author": {
        "name": "Developer Experience"
      },
      "repository": "https://github.com/your-org/conventional-commits-hook",
      "category": "Code quality",
      "directory": {
        "sample": true,
        "type": "hook",
        "updated": "2026-07-15"
      }
    },
    {
      "name": "design-review",
      "source": {
        "source": "github",
        "repo": "your-org/design-review"
      },
      "description": "Prompt that interrogates a technical design for failure modes, cost, and operational burden.",
      "version": "1.1.0",
      "author": {
        "name": "Platform Engineering"
      },
      "repository": "https://github.com/your-org/design-review",
      "category": "Code quality",
      "directory": {
        "sample": true,
        "type": "prompt",
        "updated": "2026-08-21"
      }
    },
    {
      "name": "fabric-skills",
      "source": {
        "source": "github",
        "repo": "microsoft/skills-for-fabric",
        "path": "plugins/fabric-skills",
        "ref": "24cc0d296e5e8523cc6a92e1342bc1791d7deb85",
        "sha": "24cc0d296e5e8523cc6a92e1342bc1791d7deb85"
      },
      "description": "Build and operate Microsoft Fabric workloads, including warehouses, lakehouses, real-time analytics, migrations, and medallion architectures.",
      "version": "0.3.16",
      "author": {
        "name": "Microsoft"
      },
      "homepage": "https://github.com/microsoft/skills-for-fabric",
      "repository": "https://github.com/microsoft/skills-for-fabric",
      "license": "MIT",
      "keywords": [
        "fabric",
        "lakehouse",
        "warehouse",
        "spark",
        "kql",
        "migration",
        "medallion"
      ],
      "category": "Microsoft Fabric",
      "directory": {
        "type": "plugin",
        "updated": "2026-09-15",
        "contains": {
          "skills": 23,
          "agents": 4,
          "mcpServers": 3
        },
        "components": [
          {
            "name": "activator-cli",
            "kind": "skill",
            "path": "skills/activator-cli/SKILL.md"
          },
          {
            "name": "azmon-mirroredcatalogs-operations-cli",
            "kind": "skill",
            "path": "skills/azmon-mirroredcatalogs-operations-cli/SKILL.md"
          },
          {
            "name": "databricks-migration",
            "kind": "skill",
            "path": "skills/databricks-migration/SKILL.md"
          },
          {
            "name": "dataflows-cli",
            "kind": "skill",
            "path": "skills/dataflows-cli/SKILL.md"
          },
          {
            "name": "deployment-pipelines-authoring-cli",
            "kind": "skill",
            "path": "skills/deployment-pipelines-authoring-cli/SKILL.md"
          },
          {
            "name": "e2e-fabric-cost-estimation",
            "kind": "skill",
            "path": "skills/e2e-fabric-cost-estimation/SKILL.md"
          },
          {
            "name": "e2e-medallion-architecture",
            "kind": "skill",
            "path": "skills/e2e-medallion-architecture/SKILL.md"
          },
          {
            "name": "eventhouse-cli",
            "kind": "skill",
            "path": "skills/eventhouse-cli/SKILL.md"
          },
          {
            "name": "eventschemaset-cli",
            "kind": "skill",
            "path": "skills/eventschemaset-cli/SKILL.md"
          },
          {
            "name": "eventstream-cli",
            "kind": "skill",
            "path": "skills/eventstream-cli/SKILL.md"
          },
          {
            "name": "fabriciq",
            "kind": "skill",
            "path": "skills/fabriciq/SKILL.md"
          },
          {
            "name": "fabriciq-ontology-cli",
            "kind": "skill",
            "path": "skills/fabriciq-ontology-cli/SKILL.md"
          },
          {
            "name": "git-integration-operations-cli",
            "kind": "skill",
            "path": "skills/git-integration-operations-cli/SKILL.md"
          },
          {
            "name": "hdinsight-migration",
            "kind": "skill",
            "path": "skills/hdinsight-migration/SKILL.md"
          },
          {
            "name": "onelake-catalog-govern-cli",
            "kind": "skill",
            "path": "skills/onelake-catalog-govern-cli/SKILL.md"
          },
          {
            "name": "pipeline-migration",
            "kind": "skill",
            "path": "skills/pipeline-migration/SKILL.md"
          },
          {
            "name": "search-consumption-cli",
            "kind": "skill",
            "path": "skills/search-consumption-cli/SKILL.md"
          },
          {
            "name": "semantic-model-authoring",
            "kind": "skill",
            "path": "skills/semantic-model-authoring/SKILL.md"
          },
          {
            "name": "spark-cli",
            "kind": "skill",
            "path": "skills/spark-cli/SKILL.md"
          },
          {
            "name": "sqldb-cli",
            "kind": "skill",
            "path": "skills/sqldb-cli/SKILL.md"
          },
          {
            "name": "sqldw-cli",
            "kind": "skill",
            "path": "skills/sqldw-cli/SKILL.md"
          },
          {
            "name": "synapse-migration",
            "kind": "skill",
            "path": "skills/synapse-migration/SKILL.md"
          },
          {
            "name": "variable-library-cli",
            "kind": "skill",
            "path": "skills/variable-library-cli/SKILL.md"
          },
          {
            "name": "FabricAdmin",
            "kind": "agent",
            "path": "agents/FabricAdmin.agent.md"
          },
          {
            "name": "FabricAppDev",
            "kind": "agent",
            "path": "agents/FabricAppDev.agent.md"
          },
          {
            "name": "FabricDataEngineer",
            "kind": "agent",
            "path": "agents/FabricDataEngineer.agent.md"
          },
          {
            "name": "FabricIQ",
            "kind": "agent",
            "path": "agents/FabricIQ.agent.md"
          },
          {
            "name": "FabricIQ",
            "kind": "mcp-server",
            "path": ".mcp.json"
          },
          {
            "name": "powerbi-modeling-mcp",
            "kind": "mcp-server",
            "path": ".mcp.json"
          },
          {
            "name": "fabric-sqlendpoint",
            "kind": "mcp-server",
            "path": ".mcp.json"
          }
        ],
        "notes": [
          "Installs the complete Fabric bundle. Individual skill selection is not part of a native Copilot plugin install.",
          "Fabric operations require appropriate workspace access and authentication. Some workloads require additional endpoints, permissions, or local prerequisites; follow the upstream MCP setup guide.",
          "The three bundled MCP configurations use remote Fabric endpoints. Availability and authentication support depend on your host and environment."
        ]
      }
    },
    {
      "name": "incident-notebook",
      "source": {
        "source": "github",
        "repo": "your-org/incident-notebook"
      },
      "description": "Turn an incident channel and logs into a timeline, root cause analysis, and follow-up actions.",
      "version": "1.0.2",
      "author": {
        "name": "SRE Guild"
      },
      "repository": "https://github.com/your-org/incident-notebook",
      "category": "Operations",
      "directory": {
        "sample": true,
        "type": "plugin",
        "updated": "2026-08-19",
        "contains": {
          "skills": 2,
          "mcpServers": 2
        }
      }
    },
    {
      "name": "internal-docs",
      "source": {
        "source": "github",
        "repo": "your-org/internal-docs-mcp"
      },
      "description": "Search architecture decision records, runbooks, and service catalogs from the internal docs portal.",
      "version": "1.2.0",
      "author": {
        "name": "Developer Experience"
      },
      "repository": "https://github.com/your-org/internal-docs-mcp",
      "category": "Onboarding",
      "directory": {
        "sample": true,
        "type": "mcp-server",